{"caseFolding":false,"compatibilityNormalization":false,"decodeErrorPolicy":"reject","invalidUnicodePolicy":"reject_non_scalar","newlineNormalization":"crlf_and_cr_to_lf","newlineRecipes":[{"canonicalSequence":"\n","legalSplitPolicy":"lf_boundaries_only","newlineRecipeId":"crlf","sourceSequence":"\r\n"},{"canonicalSequence":"\n","legalSplitPolicy":"lf_boundaries_only","newlineRecipeId":"cr","sourceSequence":"\r"}],"normalizationMapAggregateDomain":"mm-chat.normalization-map.v1\n","nulPolicy":"reject","offsetUnit":"utf8_byte","positionCoalescePolicy":{"geometryPositions":"never_merge","parentEquality":"byte_identical_after_canonical_coalesce","subsegmentCoverage":"gapless_non_overlapping_exact_cover","textPositions":"merge_same_unit_kind_adjacent_ranges"},"profileRevision":1,"rangeConvention":"zero_based_half_open","rendererRules":[{"insertedUtf8":"\n\n","legalSplitPolicy":"declared_renderer_boundaries_only","rendererProfileHash":"0000000000000000000000000000000000000000000000000000000000000000","rendererRuleId":"paragraph.separator","rendererRuleOrdinal":0,"structureKind":"paragraph"}],"replacementCharacterPolicy":"never_insert","schemaVersion":"normalization-profile.v1","segmentCoveragePolicy":{"allowEmptySegmentsOnlyForEmptyBuffer":true,"canonicalCoverage":"gapless_non_overlapping_exact_cover","mixedPositionKindsPerSegment":false,"ordinalBase":0,"ordinalContinuity":"contiguous"},"sourceUnitKinds":[{"canonicalUnitKey":"empty_bytes","kind":"raw_file","rank":0},{"canonicalUnitKey":"canonical_opc_uri_utf8_bytes","kind":"ooxml_part","rank":1},{"canonicalUnitKey":"synthetic_role_rank","kind":"synthetic_mineru_artifact","rank":2,"roleRanks":[{"rank":0,"role":"layout"},{"rank":1,"role":"middle"}]}],"syntaxDecodeRecipes":[{"format":"html","legalSplitPolicy":"validated_subsegments_or_atomic","recipeId":"html.entity.decode","recipeOrdinal":0,"recipeProfileHash":"0000000000000000000000000000000000000000000000000000000000000000"}],"textBufferEncoding":"utf-8","textBufferHashAlgorithm":"sha256","topLevelBlockSeparator":"\n\n","traditionalSimplifiedConversion":false,"transformKinds":["identity","newline_fold","nfc_compose","syntax_decode","renderer_insert"],"unicodeNormalization":"NFC","whitespacePolicy":"preserve_inline_space_tab_and_code_whitespace"}